,number,value,datetime_start,datetime_complete,duration,params_activation_fn,params_exponent_n_steps,params_gae_lambda,params_gamma,params_learning_rate,params_max_grad_norm,params_net_arch,user_attrs_gamma_,user_attrs_n_steps,system_attrs_fixed_params,state
98,98,140.0,2023-01-29 10:17:28.083808,2023-01-29 10:24:28.120004,0 days 00:07:00.036196,tanh,9,0.0009084041753209406,0.0040841689104159015,8.232529617639241e-05,3.0500422151760094,small,0.9959158310895841,512,,COMPLETE
99,99,607.0,2023-01-29 10:24:28.120791,2023-01-29 10:31:22.123119,0 days 00:06:54.002328,relu,7,0.0017167924644825902,0.022824424345339378,0.0002402078473840828,4.410346409137931,small,0.9771755756546606,128,,COMPLETE
